{
  "schema_version": "7.0",
  "artifact_type": "kristall_toc_registry",
  "namespace_id": "kristall-main",
  "registry_id": "urn:kristall:registry:toc",
  "category_model": {
    "reference_kos": "kos:unesco-thesaurus",
    "polyhierarchical_subjects": true,
    "country_domain_default_role": "facet"
  },
  "categories": [
    {
      "category_id": "KQ4001",
      "label": "Education",
      "category_role": "knowledge_category",
      "external_alignment": {
        "kos_id": "kos:unesco-thesaurus",
        "external_uri": "http://vocabularies.unesco.org/thesaurus/domain1",
        "notation": "1",
        "mapping_semantics": "exactMatch"
      }
    },
    {
      "category_id": "KQ4002",
      "label": "Educational sciences and environment",
      "category_role": "knowledge_category",
      "parent_category_id": "KQ4001",
      "external_alignment": {
        "kos_id": "kos:unesco-thesaurus",
        "external_uri": "http://vocabularies.unesco.org/thesaurus/mt1.05",
        "notation": "1.05",
        "mapping_semantics": "exactMatch"
      }
    },
    {
      "category_id": "KQ4003",
      "label": "Educational policy",
      "category_role": "knowledge_category",
      "parent_category_id": "KQ4001",
      "external_alignment": {
        "kos_id": "kos:unesco-thesaurus",
        "external_uri": "http://vocabularies.unesco.org/thesaurus/mt1.10",
        "notation": "1.10",
        "mapping_semantics": "exactMatch"
      }
    },
    {
      "category_id": "KQ4004",
      "label": "Educational planning",
      "category_role": "knowledge_category",
      "parent_category_id": "KQ4001",
      "external_alignment": {
        "kos_id": "kos:unesco-thesaurus",
        "external_uri": "http://vocabularies.unesco.org/thesaurus/mt1.15",
        "notation": "1.15",
        "mapping_semantics": "exactMatch"
      }
    },
    {
      "category_id": "KQ4005",
      "label": "Educational administration",
      "category_role": "knowledge_category",
      "parent_category_id": "KQ4001",
      "external_alignment": {
        "kos_id": "kos:unesco-thesaurus",
        "external_uri": "http://vocabularies.unesco.org/thesaurus/mt1.20",
        "notation": "1.20",
        "mapping_semantics": "exactMatch"
      }
    },
    {
      "category_id": "KQ4006",
      "label": "Educational management",
      "category_role": "knowledge_category",
      "parent_category_id": "KQ4001",
      "external_alignment": {
        "kos_id": "kos:unesco-thesaurus",
        "external_uri": "http://vocabularies.unesco.org/thesaurus/mt1.25",
        "notation": "1.25",
        "mapping_semantics": "exactMatch"
      }
    },
    {
      "category_id": "KQ4007",
      "label": "Educational systems and levels",
      "category_role": "knowledge_category",
      "parent_category_id": "KQ4001",
      "external_alignment": {
        "kos_id": "kos:unesco-thesaurus",
        "external_uri": "http://vocabularies.unesco.org/thesaurus/mt1.30",
        "notation": "1.30",
        "mapping_semantics": "exactMatch"
      }
    },
    {
      "category_id": "KQ4008",
      "label": "Educational institutions",
      "category_role": "knowledge_category",
      "parent_category_id": "KQ4001",
      "external_alignment": {
        "kos_id": "kos:unesco-thesaurus",
        "external_uri": "http://vocabularies.unesco.org/thesaurus/mt1.35",
        "notation": "1.35",
        "mapping_semantics": "exactMatch"
      }
    },
    {
      "category_id": "KQ4009",
      "label": "Curriculum",
      "category_role": "knowledge_category",
      "parent_category_id": "KQ4001",
      "external_alignment": {
        "kos_id": "kos:unesco-thesaurus",
        "external_uri": "http://vocabularies.unesco.org/thesaurus/mt1.40",
        "notation": "1.40",
        "mapping_semantics": "exactMatch"
      }
    },
    {
      "category_id": "KQ4010",
      "label": "Basic and general study subjects",
      "category_role": "knowledge_category",
      "parent_category_id": "KQ4001",
      "external_alignment": {
        "kos_id": "kos:unesco-thesaurus",
        "external_uri": "http://vocabularies.unesco.org/thesaurus/mt1.45",
        "notation": "1.45",
        "mapping_semantics": "exactMatch"
      }
    },
    {
      "category_id": "KQ4011",
      "label": "Technical and vocational study subjects",
      "category_role": "knowledge_category",
      "parent_category_id": "KQ4001",
      "external_alignment": {
        "kos_id": "kos:unesco-thesaurus",
        "external_uri": "http://vocabularies.unesco.org/thesaurus/mt1.50",
        "notation": "1.50",
        "mapping_semantics": "exactMatch"
      }
    },
    {
      "category_id": "KQ4012",
      "label": "Educational population",
      "category_role": "knowledge_category",
      "parent_category_id": "KQ4001",
      "external_alignment": {
        "kos_id": "kos:unesco-thesaurus",
        "external_uri": "http://vocabularies.unesco.org/thesaurus/mt1.55",
        "notation": "1.55",
        "mapping_semantics": "exactMatch"
      }
    },
    {
      "category_id": "KQ4013",
      "label": "Teaching and training",
      "category_role": "knowledge_category",
      "parent_category_id": "KQ4001",
      "external_alignment": {
        "kos_id": "kos:unesco-thesaurus",
        "external_uri": "http://vocabularies.unesco.org/thesaurus/mt1.60",
        "notation": "1.60",
        "mapping_semantics": "exactMatch"
      }
    },
    {
      "category_id": "KQ4014",
      "label": "Educational evaluation",
      "category_role": "knowledge_category",
      "parent_category_id": "KQ4001",
      "external_alignment": {
        "kos_id": "kos:unesco-thesaurus",
        "external_uri": "http://vocabularies.unesco.org/thesaurus/mt1.65",
        "notation": "1.65",
        "mapping_semantics": "exactMatch"
      }
    },
    {
      "category_id": "KQ4015",
      "label": "Educational facilities",
      "category_role": "knowledge_category",
      "parent_category_id": "KQ4001",
      "external_alignment": {
        "kos_id": "kos:unesco-thesaurus",
        "external_uri": "http://vocabularies.unesco.org/thesaurus/mt1.70",
        "notation": "1.70",
        "mapping_semantics": "exactMatch"
      }
    },
    {
      "category_id": "KQ4016",
      "label": "Science",
      "category_role": "knowledge_category",
      "external_alignment": {
        "kos_id": "kos:unesco-thesaurus",
        "external_uri": "http://vocabularies.unesco.org/thesaurus/domain2",
        "notation": "2",
        "mapping_semantics": "exactMatch"
      }
    },
    {
      "category_id": "KQ4017",
      "label": "Scientific approach",
      "category_role": "knowledge_category",
      "parent_category_id": "KQ4016",
      "external_alignment": {
        "kos_id": "kos:unesco-thesaurus",
        "external_uri": "http://vocabularies.unesco.org/thesaurus/mt2.05",
        "notation": "2.05",
        "mapping_semantics": "exactMatch"
      }
    },
    {
      "category_id": "KQ4018",
      "label": "Science and research management",
      "category_role": "knowledge_category",
      "parent_category_id": "KQ4016",
      "external_alignment": {
        "kos_id": "kos:unesco-thesaurus",
        "external_uri": "http://vocabularies.unesco.org/thesaurus/mt2.10",
        "notation": "2.10",
        "mapping_semantics": "exactMatch"
      }
    },
    {
      "category_id": "KQ4019",
      "label": "Mathematics and statistics",
      "category_role": "knowledge_category",
      "parent_category_id": "KQ4016",
      "external_alignment": {
        "kos_id": "kos:unesco-thesaurus",
        "external_uri": "http://vocabularies.unesco.org/thesaurus/mt2.15",
        "notation": "2.15",
        "mapping_semantics": "exactMatch"
      }
    },
    {
      "category_id": "KQ4020",
      "label": "Physical sciences",
      "category_role": "knowledge_category",
      "parent_category_id": "KQ4016",
      "external_alignment": {
        "kos_id": "kos:unesco-thesaurus",
        "external_uri": "http://vocabularies.unesco.org/thesaurus/mt2.20",
        "notation": "2.20",
        "mapping_semantics": "exactMatch"
      }
    },
    {
      "category_id": "KQ4021",
      "label": "Chemical sciences",
      "category_role": "knowledge_category",
      "parent_category_id": "KQ4016",
      "external_alignment": {
        "kos_id": "kos:unesco-thesaurus",
        "external_uri": "http://vocabularies.unesco.org/thesaurus/mt2.25",
        "notation": "2.25",
        "mapping_semantics": "exactMatch"
      }
    },
    {
      "category_id": "KQ4022",
      "label": "Space sciences",
      "category_role": "knowledge_category",
      "parent_category_id": "KQ4016",
      "external_alignment": {
        "kos_id": "kos:unesco-thesaurus",
        "external_uri": "http://vocabularies.unesco.org/thesaurus/mt2.30",
        "notation": "2.30",
        "mapping_semantics": "exactMatch"
      }
    },
    {
      "category_id": "KQ4023",
      "label": "Earth sciences",
      "category_role": "knowledge_category",
      "parent_category_id": "KQ4016",
      "external_alignment": {
        "kos_id": "kos:unesco-thesaurus",
        "external_uri": "http://vocabularies.unesco.org/thesaurus/mt2.35",
        "notation": "2.35",
        "mapping_semantics": "exactMatch"
      }
    },
    {
      "category_id": "KQ4024",
      "label": "Geography and oceanography",
      "category_role": "knowledge_category",
      "parent_category_id": "KQ4016",
      "external_alignment": {
        "kos_id": "kos:unesco-thesaurus",
        "external_uri": "http://vocabularies.unesco.org/thesaurus/mt2.40",
        "notation": "2.40",
        "mapping_semantics": "exactMatch"
      }
    },
    {
      "category_id": "KQ4025",
      "label": "Meteorology",
      "category_role": "knowledge_category",
      "parent_category_id": "KQ4016",
      "external_alignment": {
        "kos_id": "kos:unesco-thesaurus",
        "external_uri": "http://vocabularies.unesco.org/thesaurus/mt2.45",
        "notation": "2.45",